<?xml version="1.0" encoding="UTF-8"?>
<SftpReaderConfiguration xmlns:xsi="http://www.w3.org/2001/XMLSchema-instance"
                         xsi:noNamespaceSchemaLocation="../../../../eds-messaging-core/src/main/resources/SftpReaderConfiguration.xsd">

    <InstanceId>EMIS001</InstanceId>
    <PostgresConnetion>
        <Hostname>localhost</Hostname>
        <Port>5432</Port>
        <Database>sftpreader</Database>
        <Username>postgres</Username>
        <Password></Password>
    </PostgresConnetion>

</SftpReaderConfiguration>